{"families":["Kitchen and dining","Home decor","Paper cards and wrap","Bags and purses","Storage and boxes","Candles and fragrance","Seasonal and festive","Toys games and party","Other","Lighting","Garden and outdoor","Jewellery and accessories","Bath and personal care"],"note":"Complete Monday weeks only (the first and last partial weeks are dropped). Weeks with zero are real shop closures around Christmas.","revenue_gbp":[[54947.0,64980.0,15132.0,0.0,38187.0,30343.0,39992.0,32879.0,27294.0,20552.0,33809.0,37778.0,30516.0,26659.0,35591.0,36250.0,33363.0,27663.0,32561.0,39842.0,38508.0,36095.0,37882.0,28252.0,39055.0,23320.0,49742.0,29711.0,26156.0,37956.0,41282.0,29280.0,33722.0,36539.0,24614.0,33518.0,36537.0,33792.0,31697.0,32400.0,37783.0,47478.0,78290.0,56253.0,61117.0,54300.0,47830.0,58431.0,67460.0,76270.0,73924.0,90026.0,79913.0,65106.0,33224.0,0.0,37046.0,56528.0,118772.0,35035.0,33988.0,28005.0,44116.0,40672.0,40622.0,32700.0,40617.0,37378.0,52290.0,29951.0,38905.0,33995.0,18531.0,33085.0,51597.0,55460.0,47684.0,29079.0,76559.0,55809.0,29235.0,45691.0,42216.0,34813.0,52421.0,54115.0,36473.0,41905.0,45461.0,38500.0,33333.0,46806.0,46731.0,103601.0,47559.0,63666.0,49035.0,58005.0,45824.0,67026.0,71773.0,77915.0,69353.0,71698.0],[29058.0,43348.0,9496.0,0.0,23684.0,27935.0,25439.0,23029.0,27184.0,14153.0,33023.0,30005.0,35963.0,25540.0,34364.0,27714.0,19131.0,25148.0,23694.0,27308.0,28167.0,22314.0,24797.0,21095.0,20901.0,17839.0,24605.0,21788.0,17789.0,26061.0,20269.0,40216.0,24959.0,42816.0,22064.0,21175.0,31773.0,29555.0,19575.0,18575.0,25702.0,38324.0,44257.0,37385.0,45457.0,35908.0,35488.0,42177.0,65033.0,60856.0,51148.0,50407.0,46990.0,33187.0,12553.0,0.0,19833.0,28188.0,18109.0,20239.0,23155.0,13663.0,20997.0,24142.0,16973.0,21182.0,21385.0,20967.0,26929.0,23641.0,22731.0,20670.0,12612.0,22635.0,29221.0,37006.0,24183.0,20444.0,45776.0,24102.0,16405.0,18236.0,36656.0,23808.0,31379.0,24312.0,30007.0,26423.0,26942.0,27846.0,23254.0,37042.0,56281.0,59405.0,42046.0,66065.0,36597.0,59888.0,44701.0,57507.0,58792.0,57319.0,51672.0,56432.0],[19627.0,24707.0,4172.0,0.0,17925.0,15783.0,18301.0,13908.0,11359.0,9323.0,20305.0,16397.0,17356.0,14400.0,19954.0,28430.0,18198.0,15202.0,13632.0,15208.0,28665.0,17752.0,19276.0,22389.0,19868.0,12564.0,32118.0,17549.0,15639.0,28420.0,16807.0,21616.0,16068.0,15840.0,15397.0,25520.0,18846.0,17078.0,15795.0,15389.0,18572.0,25909.0,51936.0,27743.0,43900.0,29678.0,23533.0,33046.0,46254.0,38195.0,29178.0,29259.0,41239.0,18973.0,5549.0,0.0,12454.0,23680.0,15479.0,16008.0,12274.0,19304.0,15162.0,19228.0,18663.0,14261.0,18240.0,17077.0,24200.0,15503.0,19442.0,12859.0,9814.0,15719.0,18939.0,22336.0,12483.0,10747.0,14725.0,25687.0,15675.0,10930.0,15402.0,13411.0,17463.0,17997.0,19950.0,15537.0,16253.0,14609.0,15601.0,15845.0,16952.0,32100.0,23498.0,33444.0,21883.0,30896.0,23528.0,29727.0,41411.0,37596.0,31612.0,25690.0],[15332.0,17835.0,2725.0,0.0,15736.0,15879.0,10400.0,15483.0,11287.0,10606.0,21488.0,16326.0,14700.0,12111.0,15121.0,16136.0,17505.0,13021.0,17139.0,17056.0,22608.0,20239.0,17461.0,11226.0,16193.0,11590.0,28824.0,12189.0,15866.0,26888.0,18666.0,14693.0,20218.0,13591.0,15944.0,28723.0,17935.0,11798.0,26299.0,19594.0,17544.0,21673.0,23334.0,18543.0,25705.0,13749.0,12093.0,18768.0,29397.0,22871.0,17872.0,21462.0,19521.0,12247.0,7535.0,0.0,17280.0,15200.0,13181.0,11075.0,13084.0,7968.0,15282.0,13656.0,10003.0,15029.0,21268.0,17555.0,28057.0,13601.0,18357.0,12738.0,11129.0,15864.0,37893.0,24356.0,24732.0,16141.0,22484.0,22508.0,21830.0,22901.0,28152.0,14925.0,26208.0,21983.0,27008.0,31785.0,26878.0,30560.0,19254.0,23288.0,25944.0,32025.0,21254.0,38068.0,20783.0,21255.0,23441.0,21959.0,45275.0,36240.0,27366.0,31918.0],[12653.0,13839.0,3885.0,0.0,7981.0,8013.0,7974.0,9300.0,9266.0,6483.0,12149.0,11384.0,9932.0,11833.0,10408.0,9811.0,14482.0,9537.0,8706.0,12240.0,11859.0,12001.0,13027.0,9451.0,8278.0,7847.0,13071.0,12801.0,7979.0,10442.0,15626.0,9487.0,9365.0,8932.0,9271.0,18548.0,11777.0,10163.0,8267.0,9205.0,12003.0,16530.0,20882.0,18827.0,24672.0,19008.0,15996.0,21292.0,32473.0,24448.0,21067.0,24545.0,27485.0,16734.0,4976.0,0.0,9263.0,10228.0,12456.0,9500.0,8259.0,8163.0,9527.0,13767.0,8876.0,7620.0,10595.0,12303.0,12081.0,9486.0,8585.0,8165.0,7302.0,7156.0,13365.0,16918.0,11530.0,10261.0,11808.0,17587.0,9096.0,8670.0,7937.0,8729.0,12367.0,15422.0,12430.0,14389.0,9590.0,9847.0,12740.0,12480.0,13311.0,18481.0,14352.0,20662.0,16665.0,13857.0,16505.0,21120.0,24303.0,24190.0,18574.0,20952.0],[29455.0,23345.0,3883.0,0.0,15967.0,17994.0,13613.0,16890.0,8861.0,6946.0,8997.0,11503.0,13786.0,11956.0,13128.0,13802.0,10019.0,10540.0,9759.0,12945.0,15095.0,14170.0,12818.0,12773.0,13395.0,8649.0,17498.0,10037.0,9992.0,12128.0,9531.0,13711.0,10682.0,9453.0,8215.0,11860.0,13345.0,10135.0,8590.0,9479.0,11966.0,13782.0,14828.0,17695.0,16457.0,12863.0,21396.0,15674.0,21479.0,18022.0,25362.0,24695.0,17396.0,17449.0,3866.0,0.0,8525.0,19967.0,8638.0,8098.0,8034.0,6249.0,6601.0,8061.0,7515.0,6629.0,7712.0,9799.0,8039.0,7781.0,7202.0,12875.0,6556.0,11222.0,13053.0,14849.0,11086.0,7507.0,9576.0,9820.0,8110.0,5933.0,7917.0,9169.0,11388.0,8705.0,7725.0,8770.0,8771.0,8336.0,9801.0,9400.0,10942.0,15517.0,8171.0,10973.0,14479.0,12358.0,17015.0,19169.0,15695.0,20227.0,19888.0,17138.0],[8992.0,7798.0,1143.0,0.0,3173.0,4357.0,3088.0,2379.0,2609.0,2187.0,3662.0,4050.0,3150.0,3819.0,3375.0,3210.0,3834.0,666.0,724.0,1259.0,2281.0,1287.0,1897.0,1073.0,700.0,697.0,949.0,687.0,2202.0,1349.0,830.0,2045.0,2667.0,2650.0,4784.0,5585.0,4344.0,3910.0,6157.0,3529.0,11060.0,27913.0,29890.0,32823.0,28688.0,29182.0,20958.0,50073.0,47881.0,46338.0,29628.0,23944.0,21648.0,11740.0,4030.0,0.0,2126.0,2302.0,1906.0,2270.0,2421.0,2213.0,2524.0,3625.0,2173.0,3075.0,3322.0,2313.0,3045.0,1459.0,1447.0,1236.0,582.0,560.0,1486.0,1205.0,609.0,622.0,1201.0,2376.0,1416.0,2381.0,2301.0,2579.0,3493.0,8416.0,6208.0,4413.0,10117.0,5872.0,7263.0,14859.0,24068.0,25392.0,22024.0,28750.0,24911.0,30458.0,27010.0,33458.0,49721.0,54800.0,35896.0,34337.0],[4739.0,6003.0,1459.0,0.0,5029.0,3034.0,3660.0,5942.0,3826.0,2863.0,5212.0,7080.0,3415.0,6897.0,5059.0,9391.0,11424.0,10293.0,8705.0,8987.0,8064.0,8473.0,10512.0,9583.0,9410.0,6735.0,10357.0,7515.0,4198.0,8589.0,4901.0,5732.0,6305.0,6455.0,6200.0,6637.0,9629.0,5520.0,5100.0,5543.0,7379.0,16204.0,16441.0,16459.0,18808.0,14760.0,9099.0,11842.0,22013.0,21703.0,13012.0,14402.0,11725.0,8033.0,3494.0,0.0,5305.0,5128.0,4741.0,4968.0,5247.0,5409.0,9405.0,6108.0,9970.0,9950.0,10222.0,8152.0,11569.0,6742.0,10178.0,8648.0,5093.0,10718.0,9985.0,12684.0,10841.0,6173.0,9311.0,8781.0,7668.0,5256.0,8970.0,6177.0,10176.0,9238.0,10594.0,9774.0,13761.0,7831.0,8388.0,7262.0,9454.0,14904.0,8422.0,25085.0,16838.0,10541.0,7487.0,8810.0,13179.0,15891.0,12013.0,9890.0],[12182.0,13801.0,1954.0,0.0,8131.0,8745.0,7375.0,8219.0,5674.0,4632.0,9176.0,6378.0,10664.0,6976.0,9384.0,7389.0,8631.0,7359.0,6618.0,7492.0,7751.0,8508.0,11177.0,8695.0,8533.0,5997.0,10316.0,7417.0,8077.0,8360.0,8681.0,6789.0,6890.0,5518.0,8308.0,7592.0,5560.0,7510.0,5541.0,5167.0,6950.0,10473.0,9326.0,10516.0,17262.0,9953.0,11509.0,11806.0,12786.0,13575.0,11066.0,13152.0,15236.0,6185.0,2236.0,0.0,4257.0,4239.0,4754.0,4339.0,5219.0,4048.0,5221.0,4384.0,3716.0,5982.0,7102.0,7743.0,7397.0,5453.0,6558.0,5417.0,4623.0,6282.0,8520.0,9243.0,4957.0,4513.0,7975.0,7036.0,5497.0,4679.0,6625.0,5514.0,5832.0,6713.0,6769.0,3961.0,4809.0,5791.0,6734.0,6839.0,5854.0,8496.0,6522.0,8675.0,6903.0,8958.0,7461.0,12101.0,11719.0,14140.0,10092.0,12755.0],[14248.0,14610.0,2956.0,0.0,5740.0,7014.0,6463.0,7044.0,6114.0,3802.0,13266.0,5978.0,8101.0,7665.0,7379.0,7829.0,7010.0,6347.0,6347.0,4679.0,4645.0,3848.0,6143.0,3493.0,3584.0,2366.0,6880.0,3373.0,3064.0,4325.0,3501.0,4914.0,2774.0,4288.0,2400.0,5843.0,5727.0,3925.0,4400.0,3692.0,4213.0,6769.0,6586.0,7352.0,7166.0,5077.0,5041.0,4840.0,8857.0,7642.0,6622.0,10407.0,6487.0,8084.0,2031.0,0.0,6335.0,14488.0,3074.0,1833.0,2516.0,2267.0,4400.0,3444.0,1829.0,4312.0,3585.0,1859.0,3085.0,1608.0,3154.0,12894.0,1014.0,2170.0,6010.0,5215.0,3484.0,1842.0,5316.0,3951.0,3520.0,2946.0,3331.0,2546.0,3446.0,5659.0,2877.0,4392.0,3474.0,3755.0,4994.0,4188.0,7252.0,7585.0,3915.0,4459.0,4711.0,4753.0,18069.0,10501.0,15532.0,20912.0,15745.0,16570.0],[11812.0,5972.0,688.0,0.0,12702.0,9407.0,3055.0,2767.0,1687.0,1685.0,4368.0,8431.0,5469.0,3952.0,4742.0,6226.0,8210.0,6122.0,9656.0,9924.0,10219.0,10212.0,8689.0,15307.0,9216.0,5345.0,10618.0,8024.0,5651.0,9276.0,7211.0,4447.0,6314.0,2752.0,4604.0,2838.0,4008.0,4477.0,1805.0,2780.0,3669.0,4273.0,3363.0,3990.0,3654.0,6152.0,2826.0,4834.0,4899.0,4990.0,6581.0,6742.0,4057.0,2417.0,1642.0,0.0,3620.0,2812.0,3592.0,3606.0,3456.0,3567.0,3390.0,5041.0,3484.0,3537.0,5531.0,6254.0,6132.0,4651.0,6327.0,5633.0,4077.0,7010.0,8764.0,6464.0,4077.0,5261.0,6245.0,4732.0,5341.0,3041.0,6375.0,6102.0,7080.0,2541.0,4538.0,3607.0,3811.0,3662.0,2037.0,3193.0,2714.0,2495.0,3059.0,3849.0,2391.0,6216.0,4667.0,4448.0,4695.0,6202.0,3015.0,4545.0],[6706.0,7434.0,1512.0,0.0,2119.0,4149.0,3438.0,4150.0,2083.0,1861.0,2517.0,1997.0,2958.0,3127.0,2529.0,2695.0,2144.0,2499.0,1932.0,4307.0,3394.0,2322.0,2878.0,2327.0,3235.0,1452.0,3310.0,2844.0,3837.0,2351.0,1532.0,2217.0,2164.0,2615.0,2157.0,3200.0,3254.0,2843.0,4270.0,2890.0,3650.0,4127.0,3769.0,5650.0,6890.0,4772.0,3351.0,5572.0,5977.0,6578.0,7087.0,4589.0,4937.0,5336.0,1571.0,0.0,2407.0,2473.0,2781.0,2368.0,1086.0,945.0,2228.0,1518.0,1696.0,1786.0,1994.0,1384.0,1635.0,1618.0,1239.0,1752.0,1189.0,2056.0,3362.0,2989.0,1918.0,1322.0,1912.0,2553.0,2437.0,2538.0,2283.0,2384.0,4068.0,2263.0,2082.0,2111.0,1826.0,2660.0,1839.0,2815.0,2420.0,3925.0,3931.0,2969.0,3920.0,3636.0,4330.0,3945.0,3331.0,5166.0,3844.0,3700.0],[14282.0,7716.0,2667.0,0.0,9635.0,2791.0,3112.0,2944.0,2821.0,1799.0,2625.0,3051.0,5810.0,3207.0,3392.0,2764.0,1803.0,2706.0,2367.0,3518.0,3584.0,2798.0,1726.0,2395.0,2471.0,2202.0,2001.0,2025.0,1765.0,1957.0,1737.0,1430.0,2367.0,3629.0,1636.0,2465.0,4075.0,3684.0,2305.0,1528.